"reviewer_name","star_rating","review_date","review_text","source"
"Brina",5,"May 5, 2017","Magical realism has been one of my favorite genres of reading ever since I discovered Isabel Allende and the Latina amiga writers when I was in high school. Taking events from ordinary life and inserting elements of fantasy, Hispanic written magical realism books are something extraordinary. Many people compare Allende to Gabriel Garcia Marquez, who is considered the founder of magical realism. Until now, however, I had not read any of Marquez' full length novels so I had nothing to compare. On this 50th anniversary of its first printing, One Hundred Years of Solitude is the revisit the shelf selection for the group catching up on classics for January 2017. An epic following the Buendia family for 100 years, Solitude is truly a great novel of the Americas that put magical realism on the map. Gabriel Garcia Marquez was born in Aracataca, Columbia in 1927. Influenced by his grandmother's vivid story telling, Marquez decided at an early age that he wanted to be a writer. Upon completion of la Universidad de Cartagena, Marquez began his career as a reporter and soon began to write short stories. His earliest stories were published as early as the 1950s, yet in 1964 while living in Mexico City with his young family, he completed Solitude in a mere eighteen months. Finally published for the first time in 1967, Solitude sold millions of copies, establishing Marquez as a world renown writer, leading to his receiving the Nobel Prize in 1982. Jose Arcadio Buendia and Ursula Iguaran lived in an isolated Colombian village where branches of the same family intermarried for centuries, resulting in children born with pigs tails or looking like lizards. Determined to end this cycle of incest, Buendia and a group of pioneers crossed the mountains and founded the village of Macondo. In the mid 1800s, Macondo was a fledging community, with Buendia, an alchemist, its most respected member. Jose Arcadio and Ursula went on to have three children: Aureliano, Jose Arcadio, and Amaranta. These names and the personality traits that distinguished the original bearers of these names repeated themselves over the course of a century. Throughout the novel and the century of change to Macondo, all the Jose Arcadios were solitary individuals and inventors. Determined to decipher the gypsies secret to the universe, they holed themselves up in an alchemist's lab, rarely seen by the outside world. The Aurelianos, on the other hand, were leaders of revolution. Colonel Aureliano Buendia started thirty two civil wars yet lost all of them. A relic who fathered seventeen sons of the same name and grew to become Macondo's most respected citizen, his spirit of adventure and discovery repeated itself in the descendants who bore his name. Women held the family together. First Ursula who lived to be 122 years old and then her daughter Amaranta, the women expanded the family home and raised successive generations so that new Jose Arcadios and Aurelianos would not repeat the mistakes of their namesakes. Yet the same mistakes and characteristics occur: rejected love, spirit of adventure, lone soles willing to live for one hundred years in solitary confinement. Additionally, the two characters who predicted all the events of the novel were not even members of the Buendia family: Pilar Ternera, a card reader who specialized in fates and could look at a Buendia to know his future; and Melquiades, a gypsy who befriended the original Jose Arcadio, leading all the successive generations to a life of solitude. At first Marquez equates solitude with death. Later on he includes individuals happy to live out their days alone. In order to make a point of his examples of solitude, he interjects countless examples of magical realism: a man bleeding to death down a street, yellow butterflies announcing a man's presence, a rain of epic proportions that would not end. With these and other countless examples throughout the text, Marquez created a magical realism genre that is still widely in use by Latino writers and others around the world today. While used to the magical realism genre, Marquez usage and prose were a treat for me to read. His writing is so captivating, I read the entire novel over the course of a day because I desired to know how the Buendias cyclical existence would either repeat itself or change once and for all. Between the prose and magical realism and a memorable story for the ages, One Hundred Years of Solitude is an epic, genre changing, extraordinary novel. Authors of the last fifty years can credit Marquez' influence in their own work. I feel privileged to have finally read this saga deserving of its numerous awards and top ratings that eventually lead Marquez to earn a Nobel Prize. One Hundred Years of Solitude, a novel for the ages, meriting 5 wonderful stars.","goodreads"
"Henry Avila",5,"December 18, 2024","Jose Arcadio Buendia decides one day in his small rather impoverished town, set in South America (Colombia, in the early 1800's ) that he wants to leave, say goodbye forever to the relatives, a killing makes him feel uncomfortable there, taking his pregnant wife Ursula his first cousin, and explore the mysterious lands beyond the unknown horizon with his followers and friends over the treacherous mountains through the dense , noisy jungles full of wild animals and sickness...months pass, they have not yet seen the sea their ultimate goal. Lost with little food left surrounded by a vast  non- accessible repugnant swamp, the tired leader finds a suitable place by a calm river, after dreaming about a city of mirrors. Buendia builds a little village in this hot tropical region, he believes is encircled by water , of only twenty adobe homes, though all are happy to stop and rest. So remote that no one knows they exist, no map shows Macondo, the strange name Jose calls it. This will be a better life for all an utopian place , his people will prosper the first born will appropriately be a Buendia, the son of Jose and Ursula named after the founder of the town Jose Arcadio himself, soon another son Aureliano and daughter Amaranta seven generations will live here, the last six to be their birthplace . Macondo slowly grows, ragged gypsies somehow discover this most isolated town led by the bright Melquiades, bringing modern inventions from the outside world and some that never were of this Earth...flying carpets right out of an Arabian Nights fable, more magic turning things into different shapes and objects, in their annual welcomed visit , the local children become unfazed by such weird events. Still the gypsy Melquiades is not or does not seem quite human, more of a ghost from who knows where? Time passes and the unconventional Buendia family thrives (they have a propensity to fall in love, with their own kin) , nevertheless trouble breaks out between the Conservative and Liberal Parties in the nation. Resulting in many years of savage civil wars, the endless conflicts destroy the land eventually the army is headed by Col. Aureliano Buendia on the liberal side, son of the unstable Jose, a ruthless soldier who kills his conservative enemies as well as liberals who get in his way, yet will not name himself a general. The numerous Buendia family continues to get richer, Ursula is the rock so Macondo flourishes, many villagers live over a hundred years, trains come , electricity, phonograph records, radio, movies even baffling automobiles are spotted. The banana plantations too established nearby with their bloody workers strikes , the foreign owners arrive importing odd fashions and customs. The old decrepit Buendia house the largest in town becomes haunted by dead relatives . Still children are always being born (including Remedios Buendia, the most beautiful woman on Earth, she causes four men to die unable to get her love) most are "" illegitimate"" though, the kids not knowing who their real parents are. And slowly the outside begins to discover this town for better or worse, but will it last? A tremendous novel , one of a kind book that maybe doesn't show reality, however does tell us people are complicated and unpredictable.","goodreads"
"Dr. Appu Sasidharan (Dasfill)",5,"July 31, 2022","Your quest for one of the best books ever published will end here. The story of the Buendia family is narrated in one of the best ways we have ever seen by Márquez. The magical realism in it is simply spectacular and is the best I have seen in any book.","goodreads"
"Pakinam Mahmoud",1,"October 15, 2024","بيقولوا عليها ملحمة ورواية ساحرة..و من أجمل ما كتب ماركيز!وأنا بقول إنها مملة و تزهق وكرهتني في حياتي وفي ماركيز نفسه..و أعتقد إني مكانش المفروض أكملها وأعذب نفسي كل هذا العذاب:(صحيح لولا إختلاف الأذواق!","goodreads"
"V. A Court of Wings and Ruin is NEW ADULT/EROTICA but Goodreads editors won't tell you to include it in the choice awards",1,"February 9, 2017","WARNINGS WARNINGS I don't recommend this book if you feel uncomfortable with books that depict graphically* Pedophilia/rape  A 9 year old girl forced to marry and later bear a child to a grown man * Incest/child abuse  The Buendia family members are constantly falling in love with close cousins, half brothers, nephews. An older woman Amarantha makes out with her underage nephew * Non sensical Violence  including the cruel death of a newborn, and that's the ending scene. This book leaves you feeling disturbed *Prostitution* Cheating* Bestiality* Women treated as objects sometimes by their own parentsIf you like me grew up reading marvelous books like Harry Potter, Percy Jackson, Twilight, The Hunger games, which are all extremely strong in terms of characterization and character development and which are at times trashed by the same critics that praised this piece of cr%p, I doubt you'll enjoy this book because:* No plot, everything is a messy mix of twisted, and I mean TWISTED, disturbing, cringe-inducing family anecdotes*No character development. * Poor character presentation. Other than I know that Amarantha is somehow fierce it's difficult to describe the rest of the characters personalities. What are their goals? What do they want? What do they fear? Who are they? What are their motivations?* Poor worldbuilding. Am I supposed to know how Macondo, the setting of this book looks like? All I know is that Macondo founders were trying to reach the sea and they couldn't and were tired of travelling so I know there's no sea close to this town. The rules of this world don't seem to follow a logic, either. It's like Garcia Marques just smoke weed and added whatever he saw when he was under the effects of the weed to add magical elements here and there. I rarely notice worldbuilding issues in my reads because I have a strong imagination. Even books that don't describe the rules of their worlds or the setting properly don't turn me off, but since this book is universally praised as a ""master piece"" I was expecting more. * No coherent timeline, Little to No dialogue* Author breaking the rule of show don't tell 98% of the bookI should have tried to convince my professor to change this assigment. I should've told him that this kind of topics are potential PTSD triggers for me (which is 100% true, although usually books don't activate triggers for me, certain kind of music and smells are triggering for me) or that they are against my religious beliefs (that'd been a lie, but I wish I had lied) Maybe it wouldn't have worked and still I'd been stuck to read this horrible book, but these professors should be more responsible when assigining this kind of disturbing readings and forcing people to read them taking away our sacred right of DNF a book we don't enjoy .I'm aware that the author won a Nobel Prize, but it seems to me that it was more like the academy thought it'd be rebellious and edgy to give an award to this author leaving other more talented authors out, therefore steering controversy. Sort of like they did when they gaveBob Dylan the Nobel Prize even if he's a songwriter and poet more than a book writer.I don't even know who is supposed to enjoy this book. I think that some Hispanic readers might find something good in this book because it seems to me that the author at times was talking about Colombian/Hispanic political issues in a metaphoric way, but honestly there wasn't enough of that.Also, the opening line of this book is supposedly matter of study in English literature courses around the world 'Many years later, as he faced the firing squad, Colonel Aureliano Buendía was to remember that distant afternoon when his father took him to discover ice.' I can see why some readers might find that intriguing and get hooked from there, but I read a lot of books with great opening lines/paragraphs in commercial literature. Angefall by Susan EE, Divergent by Veronica Roth, Maze Runner by James Dashner have strong opening lines that get you hooked. I think every reader gets hooked by different opening lines, so why critics and scholars think this opening line is better than any is beyond me. However, I'll say that the ending scene was strong and extremely disturbing. It's a scene that will make you feel haunted and in search of a happy reading because  A newborn is eaten by ants. You're supposed to imagine the ants carrying only the carcass of what was moments before a lovely baby ... who was born with a pigtail O_OI'm only writing this because I need to organize my ideas for my essay. I doubt that writing my honest opinion about this trash will earn me a good mark, so I'm trying to find an angle to write about. Maybe I can write about the role of women in Garcia's books. The other Garcia's book I read was Chronicle of a foretold death which was thankfully short and somehow realistic, but still 100% misogynist. An oudated view of women is common in this author's writings.My recommendations if you are forced to read this author:* Write notes for each time a new Buendia appears. There are at least a dozen characters sharing almost the exact name and that is confusing* Don't expect character development, don't expect world building* Don't expect brilliant dialogue, although you can expect beautiful monologues* Expect a lot of info-dumping and exposition* Expect a lot of magical elements, but not the kind of magic that makes you want to live in this world.* Expect a lot of misogynism It's like the author comes from ancient times or the Taliban and his views on women are very outdated. As a demi-feminist some scenes were hard to stomach.* Keep an enjoyable read at hand because sometimes you're tired of this world and you want to get out of it by reading something good.Long story short, this book is way Overrated. Overrated doesn't cover it. I think the author, may he rest in peace, might have written it under the effects of the weed.Best reviews I found on GR:Martine'sAdam's[""br""]>[""br""]>[""br""]>[""br""]>[""br""]>[""br""]>[""br""]>[""br""]>[""br""]>[""br""]>[""br""]>[""br""]>[""br""]>[""br""]>[""br""]>[""br""]>[""br""]>[""br""]>[""br""]>[""br""]>[""br""]>[""br""]>[""br""]>[""br""]>[""br""]>[""br""]>[""br""]>[""br""]>[""br""]>[""br""]>[""br""]>[""br""]>[""br""]>[""br""]>[""br""]>[""br""]>[""br""]>[""br""]>[""br""]>[""br""]>[""br""]>[""br""]>[""br""]>[""br""]>[""br""]>[""br""]>[""br""]>[""br""]>[""br""]>[""br""]>[""br""]>[""br""]>[""br""]>[""br""]>[""br""]>[""br""]>[""br""]>[""br""]>[""br""]>[""br""]>[""br""]>","goodreads"
"Valeriu Gherghel",4,"October 7, 2024","Mă tem că multă lume a rămas cu impresia că „realismul magic” e invenția lui Gabriel García Márquez. Ce-i drept, ecoul imens al romanului publicat în 1967 a impus sintagma și a făcut să curgă valuri de cerneală pe tema „realismului magic”. Dar expresia e străveche, a fost folosită mai întîi în legătură cu pictura. Încă din anii 40 ai secolului trecut, în America latină, unii prozatori au amestecat gesturile „magice” (levitația gospodinelor etc.) și evenimentele reale într-un text care nu era nici fantastic, nici realist. Mă gîndesc, în primul rînd, la Miguel Ángel Asturias și Alejo Carpentier. Într-un interviu din 1967 (an în care a primit premiul Nobel), Miguel Ángel Asturias pretindea că el a fost cel dintîi realist magic. Se lăuda degeaba. Ca în majoritatea cazurilor, inventatorii sînt mai mulți. Și toți au convingerea că sînt singuri...Romanul lui Márquez pornește, se pare, de la un incident din copilăria autorului. Bunicul lui a fost insultat sistematic de un individ și, pierzîndu-și răbdarea, l-a împușcat. Toată lumea din sat i-a dat dreptate, inclusiv familia răposatului. Cu toate acestea, căința l-a constrîns să părăsească satul și a mers în altă parte, unde a întemeiat o așezare. Îi spunea adesea nepotului: „Tu nu știi cît te apasă pe cuget un mort”.Recitind de curînd Un veac de singurătate, am observat că multe situații se repetă (replici, gesturi, nume proprii etc.). Asta m-a dus cu gîndul la un fragment din Scriptură, care conține deviza - de mai tîrziu - a lui Giordano Bruno: Nihil sub sole novi.Așa încît romanul lui Gabriel García Márquez poate fi citit și ca o ilustrare narativă, realizată de un scriitor extraordinar, a unui verset ilustru din Ecclesiast, 1: 9: „Ce a fost va mai fi, iar ce s-a făcut se va mai face! Nu este nimic nou sub soare!”. În fond, aceasta e și concluzia prorociței Pilar Ternera, culcată în balansoarul ei de liane: „Un secol de dat în cărţi şi de experienţă o învăţase că istoria familiei nu era decît un angrenaj de repetiţii inevitabile, o roată turnantă care ar fi continuat să se învîrtească în veci, dacă n-ar fi fost uzura progresivă şi iremediabilă a osiei ei” (p.347). Pilar rămîne în familia Buendía, neclintită ca un turn, citind în cărți viitorul, iar dacă este nevoie (cînd Macondo e vizitat de morbul insomniei), trecutul. Prezicerile ei se adeveresc fără greș și oferă locuitorilor din Macondo o realitate mai blîndă...Inventivitatea metaforică a lui Márquez este cu adevărat prodigioasă.","goodreads"
"Agir(آگِر)",2,"August 25, 2019","صد سال تنهایی شاهکارِ افتضاحِ قرن: روی رینگ با گابوتنها راه لذت بردن از این کتاب: مشتِ سوپر ماریواگه کلی وقت‌تان بیهوده صرف این رمان شده، مشت‌ها را گره کرده و به سبک ماریو وارگاس یوسا نشانه بگیرید و بادمجانی بکارید زیر چشم گابوبرنده نوبل قصه گویی بی‌روح: سنیور گابوتواز مادربزرگت قصه گفتن رو یاد گرفتی!!! باورکردنی نیست!!! مادربزرگا داستان‌های بد را هم خوب تعریف می‌کردن. اما تو یه داستان خوب رو به گا دادی آقای گابوتنها راه علاج: همان مشت‌ها گابو رو باید همیشه تو رینگ نگه می‌داشتن...شاید از ترسِ ناک اوت شدن هم شده کمی بهتر قصه می‌گفت...شاید دیگر از کسل شدگی و خواب رفتن عضلات مغزمان حین خواندن رمانش رنج نمی‌بردیملباس جدید پادشاهزبان سرخ سر سبز بر باد می‌دهد...می‌دانم...اما نترسید...گابو پادشاه نیست که سرتان را به جلاد بسپارد...کمی اروپا زندگی کرده...معنای آزادی بیان رو می‌فهمد...احساس‌تان را بیان کنید...حتی اگر همه مسخره‌تان کنند و بگویند مگه کوری نمی‌بینی پادشاه لباس به تن دارد!!! حتی اگر بزرگترین شاهکارهای تاریخ یعنی مرگ قسطی و سفر به انتهای شب را بخوانی...میدانم خداسلین است...اما فحش‌بارانش کنید اگر دوستش نداریدزنده باد کاتالونیا: مرگ بر دیکتاتور فرانکوصد سال تنهايی...كتابي است كه در همان روز های اول چاپ در دنيا سر و صدای زيادی كرد...خيلي زود نسخه هايش تمام شد...پشت سر هم تجديد چاپ شد...چند سال قبل پادشاه اسپانیا، با هزینه خود(یا پول ملت) آن را تجدید چاپ کرد...کاش میشد جلوی چنین کارهای مضحکی رو گرفت...پادشاه و چهره‌ی روشنفکرانه گرفتن خیلی مسخره اسمن ندیم توام نه ندیم بادمجان: شوخی با گابوگابو جان هرچقدر که از کتابت خوشم نیومد از تو خوشم میاد...حالا که ریغ رحمتو سرکشیدی...و مرده‌ها عزیزتر میشن... به سراغ کتابت خواهم رفت...و بدون شوخی اگه اینبار خوشم بیاد...قول میدم روی رینگ بذارم چند مشت بکوبی زیر چشمام ارادتمند تو آگر. سلام منو به سلین برسون","goodreads"
"Kimber Silver",5,"August 24, 2023","""Then he made one last effort to search in his heart for the place where his affection had rotted away, and he could not find it.""
― Gabriel García Márquez, One Hundred Years of SolitudeThis dazzling tale of the Buendía family spans generations. It is a rich account of people carving out a life for themselves in Macondo, a town founded by the patriarch, José Arcadio Buendía.""At that time Macondo was a village of twenty adobe houses, built on the bank of a river of clear water that ran along a bed of polished stones, which were white and enormous, like prehistoric eggs. The world was so recent that many things lacked names, and in order to indicate them it was necessary to point.""José Arcadio Buendía is a corker! He is so hell-bent on making a wondrous discovery that he fritters away the family money on inventions purchased from a wandering troop of gypsies who miraculously show up in Macondo on occasion. Thankfully, his levelheaded wife (and first cousin), Úrsula Iguarán, works herself to the bone to make sure the family won’t starve to death. During this fantastical journey, wars were fought, fortunes won and lost, and hearts wholly decimated, leaving the jilted lovers dead in a flower bed. It must be said that the Buendia family’s foolish choices are an endless source of drama and entertainment.""Look at the mess we've got ourselves into,"" Colonel Aureliano Buendia said at that time, ""just because we invited a gringo to eat some bananas.""I’ve read Márquez before and loved his work, but this was a whole other animal! He expertly blurs the line between magic and realism so smoothly that it feels as if he was creating cinematic electricity! The horror is tempered by a big dose of whimsy that had me laughing through my tears. The writing is agonizingly beautiful, and each character exquisitely drawn.In a lifetime of reading, there are only a few extraordinary novels that touch the very fabric of a person’s being—For me, One Hundred Years of Solitude is one of those. I was transported into Márquez’s dreamlike creation, and for the past few days had forgotten the real world and lived entirely in his. My only regret is that it all had to come to an end.So, if you are looking for an epic novel to steal your breath away, look no further!Thank you, Kevin Ansbro. Your outstanding review pointed the way to this magnificent read!","goodreads"
