"reviewer_name","star_rating","review_date","review_text","source"
"Mohammed Arabey",5,"March 20, 2018","ما الذي كنت تنتظره؟- تنهدت أورسولا، وأضافت :-  إن الــزمـــن يـمـضـيالـزمـن وقسوة مروره، هو بالنسبة لي التيمة الأساسية بهذه الروايةدورة حياة زوجين واطفالهم، تحولهم لشباب ثم للكبر والعجز. وتوالي الأجيال مع الكثير من الحب والشغف..السحر والعجبوهذا السطر من الأم هو أول ما بث فيّ قشعريرة غير متوقعة بعد ربع الرواية، وأخترته لأبدأ به حكايتي مع تلك المدينة التي ابتدعها جابريل جارسيا ماركيز -رحمه الله- في عزلة من الزمنمــاكــونـدوأولا: أزاي تستمتع بهذه الرواية**ابعد تماما عن اي افكار مسبقة عنها، الفصل حوالي 25 صفحة، تحتاج لما لايقل عن 45 دقيقة إلي ساعة لقراءته، فالرواية لا تصلح مطـلقـا للقراءة السريعة-""ملحوظة: النسخة التي قرأتها للمترجم المبدع صالح علماني ""505 صفحة -ولا تقرأ أساسا الرواية سوي بترجمته-**لا تعتمد علي ""تحدي"" أو أيام معينة لأنهاء الرواية، بدأتها ..أذن اعتبر نفسك في ماكوندو لمدة مائة عام مع الأولين الذين حضروا إليها مع خوسيه اركاديو بوينديا وزوجته أورسولا**هل تريد ان تتعرف أكثر علي الزوجين الذين ستصطحبهم وذريتهم لمائة عام وعن تاريخهم واسباب نشأتهم لتلك المدينة؟..الفصل الثاني سيمنحك هذا التاريخاذا ما فعلت كل هذا، ستجد نفسك تعيش بالأحداث وتتعرف علي أجيال خوسية من الـ-'أوريليانو'-ات و ال-'خوسيهـ'-ات دون الحاجة لتكرار العودة الي شجرة العائلة، والتي ستجدها في أخر صفحة بالرواية، حيث ستجد أنك تتعرف علي الأجيال كأنهم أفراد من عائلة تعيش معهاففي اكبر بيوت مدينة ماكوندو الصغيرة ستعيش اياما وشهور واعوام مع تلك العائلةستعيش معهم منذ بداية ولادة ،خوسيه أركاديو  الابن البكري لخوسيه اركاديو بوينديا وخوف أمه أورسولا من أن يكون بذيل خنزير لتخوفها من حقيقة انها وزوجها ابناء عمومة, وستفرح لأن الله استجاب دعائها ورزقها بخوسيه طفلا كامل الصحةوابنهما الثاني ،أوريليانو  المولود بعيون مفتوحة علي العالم يريد ان يتعرف علي كل مابه ويعيشهيندهش كوالده بالأختراعات التي يجلبها الغجر معهم من كل ارجاء العالم , بالاخص الغجري  ميلكليادس  الساحر الذي يذكرني بـجاندلف  من ملك الخواتمستعيش شغف الأب بتجاربه الخيميائية مع ميلكليادس، وانبهار بلدة ماكوندو الصغيرة بالبساط السحري وستتذوق حلوي سكاكر الحيوانات التي تعدها اورسولا  وستتعرف علي الضحكة المجلجلة لـبيلار تيرنيرا  والتي ستلهب شباب عائلة خوسيه كأمرأة كاملة النضج وتكون اسهاماتها الغير شرعية سببا في زيادة افراد العائلةوستأتي ريبيكا بكرسيها الهزاز واصبعها في فمها منذ صغرها وحتي وفاتها، معها جوال من القماش به عظام مقرقعة هي كل ماتبقي من والديها، ليتبناها خوسيه أركاديو بوينديا ، ولتشعل غيرة لا تنطفئ بقلب  أمارانتا بعدها بسنوات لتصارعهما علي الفوز بقلب رجل واحدغجر ، سحر ، انبهار ، استكشافات واختراعات ، سفينة علي مبعدة كبيرة عن البحر ، بساط سحري ، سكاكر علي شكل حيوانات ، ذهب محروق ، حجر الفيلسوف ، جليد ، شهوة ، حب ، غيرة ، موسيقي البيانولا ، وأفراح ستعيشها في ماكوندو مع تلك العائلةولكن كل شئ بدأ في التغير عندما قررت أورسولا دهان واجهة بيتها بعد التوسعات إلي الابيضفبالرغم من وباء الأرق -الذي هربت منه أميرة هندية وأخيها من بلدهم ليعملوا كخدم ببيت خوسيه أركاديو بوينديا- بل وأي أمراض بالدنيا أصابت ماكندو لا تقارن أبدا بأقذر الأمراض والتي تسببت في موت الكثيرين من اهل القريةالسياسةوالتي بمجرد أن دخلت بواقعيتها وقذارتها، ظهر الموت والدماء في ماكوندوالنظاميون الذي يقتلون من اجل حفظ النظام بالقمع ، والليبراليون الذين يقتلون -ايضا- من اجل الحرية ونبذ القمعوبمجرد الأعلان عن تمثيل في البرلمان ، تنصل الليبراليون الثوار عن كولونيلهم و ثوارهم وثورتهم..وبدأت حملات الأعدام للثوار..وبدأت تظهر معالم الزمن والشيخوخة علي ماكوندو ، بمجرد دخولها نطاق السياسة القذرةوهنا فعلا شعرت بقسوة الزمن بهذا المشهد العبقري عندما تزور أورسولا ابنها الثوري الذي تنصل عنه الجميعوالحقيقة أنه ظل مستغرقا في أفكاره، مذهولا من الطريقة التي شاخت بها القرية خلال سنوات قليلة، كانت أوراق أشجار اللوز بالية. والبيوت المطلية باللون الأزرق، ثم بالأحمر، والتي أعيد طلاؤها بالأزرق ثانية، فقد انتهت إلي لون غير محدودما الذي كنت تنتظره؟- تنهدت أورسولا، وأضافت :-  إن الــزمـــن يـمـضـي-وهو كذلك -وافقها أوريليانو -، ولكن ليس إلي هذا الحدوهكذا، فإن المقابلة المنتظرة منذ وقت طويل، والتي أعد لها كل منهما الأسئلة، بل وتوقع الأجوبة عنها، تحولت إلي حديث يومي عاديوهنا شعرت وكأنها ليست أورسولا من يقول هذا، بل سمعته من جدتي، من أمي... كلما ترك الزمان آثار مروره القاسية علينا وكل ماحولنا.. هنا شعرت فعلا بقسوة الزمان متجسدا في آثاره علي المدينة التي شهدت أنشاءها وحتي نهايتهابل ولاحظ مدي حنق -الطبيعي الواقعي والذي أتفق معاه تماما- الماركيز من لعبة السياسة القذرة~~~~~~~~~~~وتتوالي الأجيال والأحداث بصورة أسرع، المزيد من الجنون والعزلة، المزيد من سكاكر الحيوانات، حفلات و رقص و رخاء، عزلة و أنغلاق و تماثيل قديسين ومخطوطات ميلكليادس الغجري التي لم يصل أحد لتفسيرها بعدقلب عذراء أحترق بالحب يمنعه خوفه من الأعتراف به و تقبله ، ضحكات قارئة أوراق الطالع العجوز مازالت تثير الشباب ، روح الجميلة البريئة تصعد لبارئها ، سمكات ذهبية و أكفان تصنع و تغزل مرة تلو أخريو تتوالي اﻷجيال في ماكوندو و بيت عائلة الفقيد جوسيه آركاديو بوينديا الذي قاوم الأنغلاق رغم تقلبات الحياةستشهد دخول الأستثمار اﻷجنبي وشركة الموز مدينتك الصغيرة و ستدرك من خلال الأحداث كيف صور قبح واقع الاستغلال الأجنبي ... ولن تملك سوي التعجب من تشابهه بواقعنا كما صوره هذا المشهدخرج خوسيه آركاديو الثاني من الغفلة وتخلي عن موقعه كرئيس فريق عمل في شركة الموز ووقف إلي جانب العمال. وسرعان ما اتهم بأنه عميل لإحدي المؤامرات العالمية ضد النظام
وتتوالي مرة أخري الأجيال .. والضحاياضحايا وشهداء الأستعمار الأجنبي يتم التغطية عليهم بتعتيم اعلامي ، قطار محمل بالموتي ، حلم بالبابويه ، ورغبات مكبوتة وابناء حرام أخري ، ومحاولات أخري لتفسير مخطوطات ميلكليادسويدور الزمن في دائرته المغلقة كما ستلاحظ مع أورسولا في ذلك المشهد المؤثر العبقري
حرك رأسه بإتجاه الباب، وحاول الأبتسام، وكرر دون معرفه مسبقة، جملة قديمة لأورسولا، إذ قال مدمدما-ماذا تريدين، فالزمن يمضي-صحيح - قالت أورسولا- ولكن ليس إلي هذا الحدوما أن قالت ذلك حتي أنتبهت إلي أنها تقدم الجواب نفسه الذي تلقته من الكولونيل أوريليانو بوينديا في زنزانته، وأحست بالقشعريرة وهي تتأكد مجددا من أن الزمن لا يمضي وإنما يلتف دائريافراشات صفراء ، وفيات غير مفاجأة وشجن متوقع ، مطر غزير يستمر لأربع سنوات ، خراب ونمل ابيض وأحمر... والــزمن يمضي ، وإن كان بشكل أسرع كما ستلاحظ مع أورسولا ايضا بهذا المشهد
""السنون الآن لا تأتي مثل السنوات من قبل"" اعتادت ان تقول ذلك، شاعرة بأن الواقع اليومي يفلت من بين يديها. فمن قبل -فكرت- كان الأطفال يتأخرون طويلا في النمو. وليس عليها إلا أن تتذكر كل الزمن الذي أنقضي قبل أن يذهب أبنها البكر خوسيه أركاديو مع الغجر، وكل ماجري قبل أن يعود ملونا كحية، ومتحدثا مثل فلكي ; والأشياء التي حدثت في البيت قبل أن ينسي آركاديو وآمارانتا لغة الهنود، ويتعلما القشتالية. ولا بد من رؤية أيام الشمس والصحو التي تحملها خوسيه أركاديو المسكين، تحت شجرة الكستناء، وكم كان عليها أن تبكي موته، قبل أن يحملوا إليها كولونيلا يحتضر اسمه آوريليانو بوينديا لتجد أنه بعد كثير من الحروب، وبعد كل ما عانته من أجله، لم يبلغ الخمسين من عمره بعدففي زمن آخر، وبعد أن تمضي النهار بطوله في صنع حيوانات من السكر، كانت تجد فائضا من الوقت للعناية بالأطفال. أما الآن بالمقابل، عندما لم يعد لديها شئ تفعله، تضطرها نوعية الزمن الردئ إلي ترك الأمور غير ناجزة بالكامللقد قام العبقري بتلخيص كثير من الأحداث منذ بداية الرواية في تلك السطور القليلة بربعها الأخير من وجهه نظر أقوي بطلاته أورسولاكم مرة شعرت بأن هذا الكلام سمعته في الحقيقة من احد الكبار؟ بل كم مرة انت نفسك شعرت بصحته فعلا؟الزمن الغادر~~~~~~~~~وتتوالي الأحداث أسرع بتسارع حركة الزمان القاسية.. ستزداد عزلتك وتعايشك حتي تلمس شيخوختك مع شيخوخة المدينة بالرغم من صغر سن أخر اجيالها.. والذي سيفك رموز رقائق ميلكيادس الغجري التي كتبت من مائة عام من تاريخ ماكوندوحتي تصل للنهايةمائه عام من السحر ، الحب ، الجو الأسري ، حب الاستكشاف ، الخوف ، العشق ، الخطيئة ، القداسة ، السياسة ، كرم الضيافة ، الأنغلاق ، قراءة الطالع والنبوءات مائه عام من قسوة الزمان ، من الخلود ومن الفناء،, من السياسة ومن البراءة ، مائه عام من العزلة***************************************نقطة هامة أخيرةأعتقد أن من سلبيات الرواية هي بعض أحداث الجنس بين اﻷقارب بطريقة شاذة أحيانا وإن كانت اللغة هنا ليست ببذاءة البعض وليست حتي كشطحات زيدان أو الأسواني أو حتي أسلوب مراد المستفزولكن قد لا تنتبه لمخاوف أورسولا حول ذيل الخنزير التي ذكرت بالبداية، ولكنك بالتأكيد عند إنتهائك من الرواية ستدرك المغزي الراقي للرواية وأنة كان دائما بها منذ البداية... عن اختلاط الأنسابحدثه الخمار عن نكبة ذراعه, فقد كانت متيبسة وشبه محروقة,لأنه رفعها علي أمه. وحدثه أوريليانو عن نكبة قلبه المتيبس وشبه المحروق, لأنه رفعه علي أخته
وستدرك أن ما ظننته مجرد سلبيات هي حكمة أخري يقدمها جابريل جارسيا ماركيز باسلوبه الراقي -وايضا بالتأكيد المترجم الرائع صالح علماني- وبحرفية غريبة متميزةفأسلوب سرد جابرييل جارسيا ماركيز الغريب سيغرقك في الأحداث الواقعية الممزوجة بسحر غريبكأسلوب حكايات الجدات مع بعض حرارة الشباب ليخلق جوا عجيبا من السرد يخلط فيه بين أحداث لاحقة و احداث مضت 'فلاش باك و فلاش فوروارد' بطريقة عجيبة لن تقلل من استماعك و إنما قد تزيد شغفك و أثارتك لمصير تلك العائلة والمدينةستصارع مع أورسولا أيجواران زوجة خوسيه أركاديو بويندا الزمن في مائة عام .. تهزم السياسة الفاسدة والاستثمار،بل الاستعمار، الاجنبي المستغل ..ولكن إلا الزمن... فلا هازم للزمنستظل متشبثا معها ببيت المجانين، بيت تلك العائلة الغريبة وتفهمه وتتتعاطف معه وتحاول ان تجعله مفتوحا دائما للزوار ليقضي علي العزلة التي يفرضها علينا الزمنستشفق علي تلك المهمة الجليلة الحزينة التي ستتحملها أمارانتا قبل وفاتها... وفي نفس الوقت ستجد نفسك ايضا متعاطفا مع اورليانو الثاني الذي جاهد الزمن ليستمتع بالحياة القصيرةأبتعدي ايتها الابقار ..فالحياة قصيرة
وفي رأيي فعلا أورسولا من أجمل الشخصيات النسائية التي قرأتها ، رأيت فيها شيئا ألفته جدا ، شعرت معها بأحساس الأمومة وربة الدار ، من أكثر الشخصيات التي أثرت في فعلا بصراحه من الاشياء التي دائما تجعلني اعيش بالرواية هو اني دائما ما اقوم بتوزيع الشخصيات والادوار علي فنانين في بالي كي اري تعبيراتهم وهم يمثلونها اثناء قرائتي في خيالي.. وهذا يفيد كثيرا وبالرغم الاختيار العشوائي الي حد ما لـ""إيفا لونجوريا"" بطلة ربات البيوت اليائسات قد تخوفت منه عندما وجدت دور أورسولا ليس بصغيرإلا أن رسم الشخصية فعلا اعجبني واجادت الدور في خيالي وتليق به فعلاما الذي كنت تنتظره؟- تنهدت أورسولا, وأضافت :-  إن الــزمـــن يـمـضـيستظل ماكوندو حلما جميلا مهما غزته الكوابيس في بعض محطاته..وسيظل حنيني اليها كأنها ماض عشته وبالرغم من أتفاقي شيئا ما مع موقف صاحب المكتبة بماكوندو عندما قال في الاحداث أن الماضي ما هو إلا كذبة، وأنه ليس للذاكرة من دروب للعودة، وأن كل ربيع قديم لا يستعاد، وأن أشد الغراميات جموحا، وأكثرها رسوخا، ليست في نهاية المطاف إلا حقيقة زائلةإلا أن كما قال جابريل جارسيا ماركيز نفسه انه لا يهم ما حدث في الماضي، وانما كيف نتذكره هذا هو المهمكما في تلك المقولة التي وضعتها في الريفيو المبدئيوأقل مايمكن ان نحول ذكري هذا الرجل بآحياء الواقعية السحرية ، حكايات الجدات الجذابة الغريبة التي تعود بنا لذكريات ايام الصبا... الواقعية السحرية التي إن ظلت وعاشت بقلوبنا فلن ينجح اي ركاكة أو بذاءة أو قتامة ينسب لها الواقع الحالي في إظلام قلوبنا.. لنقرأ واقعيته السحرية..الحالمةويعيش السحر في قلوبنا ، لنتذكره للأبدR I P Gabriel Marcus Your Magical Realism will always enchanting and illuminating our hearts , will defeat the dirty realism that we unfortunately stuck in.. Your magical words and novels will be read....foreveryou're enchanted محمد العربيمن 24 ابريل 2014الي 2 مايو 2014اشكر جدا كل من رشح الرواية لي من الأصدقاء ، وأشكر أيضا دعم الأصدقاء في انتظار رايي في الرواية بتعليقاتكم واتمني أن تعجبكم كما اعجبتني ، واتمني ان يكون رايي -الذي حاولت اختصاره والله- أن يكون واضحا وملائما","goodreads"
"Sean Barrs",3,"April 16, 2020","One Hundred Years of Solitude is an absolute ground-breaking book; it is intelligent, creative and full of powerful anecdotal wisdom. It deservedly won the noble prize for literature. But how enjoyable is it? How readable is it?Gabriel García Márquez, plays around with reality itself; he plays around with the limitations of fiction; he uses elements of magic, of the fantastic, to give voice to things that could never be said quite as effectively in normal terms: he breaks through realism and establishes his own original style. He did nothing short of launching a new mode of literary address: magical realism. He wasn’t the first writer to do such a thing, though his writing was the first to attract criticism which, in effect, allowed for it to be defined and recognised. For me, the strongest element of the book resides in its inherent pessimism, with its unfortunate understanding that history can (and will) repeat itself. All good intentions go awry, indeed, One Hundred Years of Solitude challenges the progress (or lack thereof) of society. It creates a self-contained history in its isolated framework, which, arguably, reflects the nature of mankind or, at least, it echoes Columbian history with its liberal history in the face of imperialism. No matter how much we want to change the world (or how much we believe in a revolution or a new political ideal) these good intentions often become warped when faced with the horrors of war and bloodshed. Nothing really changes. There’s no denying the success of Márquez’s epic; there’s no denying its ingenuity. I really enjoyed parts of the novel but it was awfully difficult to read, uncomfortably so. The prose is extremely loose and free flowing to the point where it feels like thought; it’s like a torrent of verbal diarrhoea that feels like it will never end. Characters die, eerily similar characters take their place within the story and the narrative continues until the well has completely run dry of any actual life. It is pushed so terribly far, one hundred years to be precise. And that’s my biggest problem. I’m a sentimentalist. I like to feel when I read. I like to be moved either to anger or excitement. I want to invest in the characters. I want to care about their lives and I want to be provoked by their actions. Márquez’s approach meant that this was impossible to do so. It’s a huge story, told in just a few hundred pages. It’s sweeps across the lives of the characters, some exceedingly important characters in the story are introduced and die a very short time after to establish the sheer futility of human existence and effort Márquez tried to demonstrate. Márquez writes against European tradition and the legacy of colonialism; he creates something totally new, which is becoming increasingly hard to do. Although I do appreciate this novel, I did not enjoy reading it as much as I could have done.Facebook| Twitter| Insta| Academia","goodreads"
"Martine",2,"July 14, 2008","I must have missed something. Either that, or some wicked hypnotist has tricked the world (and quite a few of my friends, it would seem) into believing that One Hundred Years of Solitude is a great novel. How did this happen? One Hundred Years of Solitude is not a great novel. In fact, I'm not even sure it qualifies as a novel at all. Rather it reads like a 450-page outline for a novel which accidentally got published instead of the finished product. Oops.Don't get me wrong. I'm not disputing that Marquez has an imaginative mind. He does, unquestionably. Nor am I disputing that he knows how to come up with an interesting story. He obviously does, or this wouldn't be the hugely popular book it is. As far as I'm concerned, though, he forgot to put the finishing touches to his story. In his rush to get the bare bones on paper, he forgot to add the things which bring a story alive. Such as, you know, dialogue. Emotions. Motivations. Character arcs. Pretty basic things, really. By focusing on the external side of things, and by never allowing his characters to speak for themselves (the dialogue in the book amounts to about five pages, if that), Marquez keeps his reader from getting to know his characters, and from understanding why they do the things they do. The lack of characterisation is such that the story basically reads like an unchronological chronicle of deeds and events that go on for ever without any attempt at an explanation or psychological depth. And yes, they're interesting events, I'll grant you that, but they're told with such emotional detachment that I honestly didn't care for any of the characters who experienced them. I kept waiting for Marquez to focus on one character long enough to make me care about what happened to him or her, but he never did, choosing instead to introduce new characters (more Aurelianos... sigh) and move on. I wish to all the gods of fiction he had left out some twenty Aurelianos and focused on the remaining four instead. With three-dimensional characters rather than two-dimensional ones, this could have been a fabulous book. As it is, it's just a shell.What a waste of a perfectly good story.","goodreads"
